{
  "name": "Draft - airy pad",
  "oscillators": [
    {"wavetable": "AuroraPad", "octave": 0, "detune": 0.0, "blend": 0.7},
    {"wavetable": "Noise", "octave": 1, "detune": 3.0, "blend": 0.1}
  ],
  "envelope": {"attack": 0.8, "decay": 1.2, "sustain": 0.75, "release": 1.5},
  "notes": "Generated by heuristic prompt engine using mood=pad context."
}
